{
  "v" : 1,
  "messageId" : "0b8f6a52-3c1d-4e2f-9a7b-5c6d7e8f9a12",
  "idempotencyKey" : "364687704e87faede538eaba07d71132e9c7339b9d6683a7e09db63816e8bbf8",
  "kind" : "NOTIFY",
  "organizationId" : 1,
  "createdAt" : "2026-07-15T05:08:00.120Z",
  "source" : {
    "type" : "FLOW",
    "flowId" : "f-co2",
    "flowVersion" : 4,
    "nodeId" : "n-notify-1",
    "triggerMessageId" : "7f3a9c1e-2b4d-4f6a-8c0e-1a2b3c4d5e6f",
    "spaceId" : 31
  },
  "priority" : "AUTO",
  "payload" : {
    "event" : "flow.notify",
    "severity" : "WARNING",
    "policyId" : 3,
    "recipients" : [ ],
    "templateKeys" : {
      "*" : "flow.co2.high"
    },
    "variables" : {
      "co2" : 1500
    },
    "aggregateWindowSec" : 120,
    "aggregateKey" : "space-31"
  }
}
